date,pos,conviction,reasoning
2021-09-03,0.05,0.35,"Breadth is exceptionally strong at 90% of sectors above 6-month average, suggesting underlying market health and limited mean-reversion risk. However, cyclicals have lagged defensives by 2% over 4 weeks with minimal dispersion (2%), indicating market caution amid concentrated narrow strength. The combination argues for a slight long bias but with low conviction—this is a week to remain mostly flat given insufficient directional clarity."
2021-09-10,0.05,0.25,"Breadth is healthy with 80% of sectors above their 6-month average, suggesting underlying market resilience. However, the 1% cyclical underperformance over 4 weeks and very tight dispersion (2%) indicate a narrow, consensus-driven market with limited rotational energy. This lack of differentiation and cyclical weakness argues against a strong long stance, but breadth doesn't warrant tactical shorts. A modest long bias reflects the breadth positive while respecting the absence of meaningful conviction drivers."
2021-09-17,0.25,0.45,"Cyclical outperformance over the past month and broad sector participation above the 6-month line suggest modest near-term momentum, but low dispersion (3%) indicates limited convictability in sector rotation drivers. The combination warrants a modest constructive lean rather than conviction positioning."
2021-09-24,0.05,0.25,"Breadth is solid (70% above 6-month average) suggesting underlying health, but cyclical-defensive flat performance and very tight sector dispersion indicate momentum has stalled. The setup offers minimal edge—a slight long bias reflects broad participation without strong directional conviction."
2021-10-01,0.05,0.25,"60% of sectors above 6-month average shows modest participation without breadth dominance, and cyclical outperformance (+3%) is moderate rather than commanding. 6% dispersion suggests selective leadership but not broad risk-on conviction. Modest long bias warranted given cyclical momentum, but low conviction reflects mixed signals and typical week-to-week noise."
2021-10-08,0.0,0.15,"Market breadth shows 50% of sectors above 6-month average—neutral, not breadth strength. Cyclical outperformance (+4% rel return) is modest and could reflect a 4-week bounce rather than structural shift. Sector dispersion at 7% is moderate, not extreme. No clear directional signal warrants positioning; conditions suggest trading near fair value with minimal edge."
2021-10-15,0.35,0.55,"Cyclicals significantly outperforming defensives (+5% over 4 weeks) and 90% of sectors above 6-month averages signal broad momentum and risk appetite. However, 6% dispersion is moderate rather than exceptional, and these are trailing metrics that may not persist. This warrants a moderate long position with measured conviction, respecting that mean reversion remains a real risk even amid breadth strength."
2021-10-22,0.05,0.25,"Extreme breadth (90% of sectors above 6-month average) with strong cyclical leadership and historically high dispersion suggest strong market momentum, but such extended conditions often leave little room for continuation. Position modestly long as a hedge against continued strength, but with low conviction given the lack of edge in overbought territories with limited catalysts disclosed."
2021-10-29,0.15,0.4,"Breadth is extremely strong with 90% of sectors above their 6-month average, and cyclicals have outperformed defensives by 3% over the last month, suggesting genuine momentum in risk appetite. However, tight dispersion (3%) and lack of differentiation across sectors indicates this strength is broad but not deep or convictive. The setup warrants a modest long tilt, but low conviction reflects the absence of compelling forward-looking catalysts or extreme positioning signals to sustain acceleration into the new week."
2021-11-05,0.15,0.35,"All sectors above 6-month averages and cyclical outperformance by 400bps suggests underlying strength, but very low dispersion (4%) indicates narrow participation and potentially exhausted momentum. No clear edge to press long; modest long bias reflects breadth resilience rather than conviction-driven signal."
2021-11-12,0.15,0.4,"Breadth is healthy with 90% of sectors above 6-month average and cyclicals outperforming defensives by 2% over 4 weeks, suggesting modest residual risk-on momentum. However, low dispersion (3%) indicates sector returns are bunching, which often precedes consolidation or mean reversion rather than extension. The data lacks urgency; mild long bias rather than strong conviction is warranted."
2021-11-19,0.15,0.45,"Breadth is strong with 90% of sectors above 6-month averages, and cyclicals have outperformed defensives by 2% over 4 weeks, suggesting constructive underlying momentum. However, sector dispersion of only 5% indicates relative homogeneity in returns with limited differentiation, and the outperformance margin is modest. This is a 'lower conviction long' setup—enough tailwind to fade flat positioning, but insufficient breadth extremes or dispersion dynamics to justify stronger conviction. I size cautiously given the mixed signals."
2021-11-26,0.05,0.3,"Extremely tight dispersion (2%) and zero cyclical-defensive divergence suggest a crowded, consensus-long environment with little directional conviction. High sector breadth (90% above 6M) is bullish but leaves minimal room for surprise. The lack of relative rotation signals could indicate a choppy consolidation week, warranting a slight long bias given the breadth setup, but conviction remains very low."
2021-12-03,0.0,0.0,"Sector breadth is moderately healthy at 70% above 6-month average, but cyclical underperformance (-3% vs. defensive over 4 weeks) and extremely tight dispersion (3%) suggest early-stage rotation pressure without clear directional conviction. This setup offers no reliable edge for directional positioning."
2021-12-10,0.15,0.35,"90% of sectors above 6-month averages suggests broad strength and limited downside risk, but cyclicals have underperformed defensives by 3% over 4 weeks while dispersion remains compressed at 3%, indicating narrow leadership and potential market hesitation. The breadth is healthy but rotation signals are mixed—enough to lean modestly long without conviction given ambiguity about whether cyclical weakness reflects caution or rotation completion."
2021-12-17,0.15,0.35,"Broad sector participation (80% above 6-month average) suggests structural support and healthy breadth, but cyclical underperformance (-7% rel. over 4w) and extremely low dispersion (4%) indicate momentum stalling and consensus crowding rather than conviction-driven rotation. Modest long bias reflects modest breadth strength without sufficient cyclical follow-through to justify meaningful risk-taking."
2021-12-24,0.15,0.35,"90% of sectors above 6-month average suggests broad strength, but cyclicals have underperformed defensives by 4% over 4 weeks, indicating late-cycle risk-off rotation. Low 2% dispersion limits rotation conviction. Modest long bias reflects broad market resilience against emerging defensive preference; sizing reflects genuine uncertainty about whether the rotation deepens or stabilizes."
2021-12-31,0.15,0.35,"90% of sectors above 6-month average suggests broad strength, but cyclicals have underperformed defensives by 4% over 4 weeks, indicating late-cycle risk-off rotation. Low 2% dispersion limits rotation conviction. Modest long bias reflects broad market resilience against emerging defensive preference; sizing reflects genuine uncertainty about whether the rotation deepens or stabilizes."
2022-01-07,0.0,0.1,"Current breadth metrics show no clear rotational edge. While 90% of sectors above 6-month averages suggests broad strength, the recent 1% underperformance of cyclicals versus defensives and modest 4% dispersion indicate market hesitation and mixed directional signals. Without a compelling shift in sector leadership, sector rotation, or breadth deterioration, this setup offers no reliable trading conviction."
2022-01-14,0.35,0.6,"90% of sectors above 6-month average reflects broad-based strength and healthy market internals. Cyclicals outperforming defensives by +3% over 4 weeks signals sustained risk-on appetite and economic confidence. However, 6% dispersion suggests some divergence is beginning to emerge, warranting a measured bullish stance rather than maximum conviction. The combination of breadth and cyclical leadership warrants a meaningful long bias, but not extreme sizing given early signs of dispersion widening."
2022-01-21,-0.25,0.35,"Only 30% of sectors above their 6-month average signals broad weakness and deteriorating breadth, a warning signal that argues for reduced exposure. Cyclicals have underperformed defensives by 3% over 4 weeks, suggesting risk-off positioning is already in place, but the modest 7% dispersion indicates this is not yet panic—supporting a cautious rather than aggressive stance. Lean short but with low conviction given the lack of extreme deterioration."
2022-01-28,-0.3,0.4,"Only 30% of sectors above their 6-month average signals broad market weakness and lack of breadth. Cyclicals underperforming defensives by 2% over 4 weeks indicates risk-off momentum. Low dispersion (8%) suggests a crowded trade but in a weakening backdrop. This warrants a modest short bias, though structural uncertainty limits conviction."
2022-02-04,-0.15,0.35,"Only 40% of sectors above 6-month average signals broad weakness and deteriorating breadth. Cyclicals have underperformed defensives by 4% over the last month, indicating risk-off rotation. Low dispersion (6%) suggests limited tactical opportunity, but the combination of breadth weakness and cyclical underperformance warrants a modest defensive lean into the coming week."
2022-02-11,-0.35,0.55,"Only 30% of sectors above their 6-month average signals broad weakness and deteriorating breadth; cyclicals have underperformed defensives by 3% over 4 weeks, indicating risk-off positioning. Low dispersion (5%) suggests sector rotation is stalling rather than churning into fresh opportunities. This combination points to a fragile market vulnerable to further retracement."
2022-02-18,0.0,0.1,"Very weak breadth signals with only 30% of sectors above their 6-month average, suggesting narrow participation. Cyclicals have outperformed defensives by just 2% over 4 weeks—modest and potentially exhausted—while low dispersion (4%) indicates little rotational momentum. No clear directional edge to commit capital."
2022-02-25,0.0,0.15,"Sector breadth is weak (only 40% above 6-month averages), cyclical-defensive momentum is flat, and return dispersion is very tight at 2%, suggesting narrow leadership and low conviction across the market. These conditions offer no clear directional edge and warrant a near-neutral stance."
2022-03-04,-0.25,0.4,"Only 40% of sectors above their 6-month average signals broad-based weakness and deteriorating breadth. Cyclicals have significantly lagged defensives over the past month (-5%), indicating risk-off rotation. The low dispersion (5%) suggests sector divergence is not extreme, but the combination of narrow participation and cyclical underperformance points to defensive positioning. Modest short bias reflects genuine technical concerns without conviction for a sharp drawdown."
2022-03-11,-0.35,0.55,"Only 20% of sectors trading above their 6-month average signals a market-wide recovery underperformance and weak breadth. Cyclicals lagging defensives by 5% over 4 weeks indicates risk-off rotation, suggesting equity investors are de-risking. Low dispersion (6%) combined with broad weakness implies systematic rather than idiosyncratic pressure—likely continued margin compression or rising rates. This pattern typically precedes further consolidation or pullback."
2022-03-18,0.0,0.0,"Sector rotation metrics show no directional conviction: exactly 50% of sectors above 6-month average (neutral), cyclicals underperforming defensives by -2% over 4 weeks (modest but not decisive), and low dispersion of 3% (suggesting broad-based, not divergent movement). Without a clear breadth or rotation signal, standing aside is appropriate."
2022-03-25,0.0,0.0,"Sector breadth shows no meaningful rotation signal: cyclicals flat vs defensives, only 60% of sectors above 6-month average (neutral), and 4% return dispersion is unremarkable. With no clear directional driver from rotation or breadth, there is no edge to express."
2022-04-01,0.0,0.1,"Breadth indicators show no directional edge: exactly half of sectors are above their 6-month average (neutral), cyclical outperformance is modest at 1% over 4 weeks, and sector dispersion at 2% is low. No clear rotational signal or breadth thrust warrants a meaningful directional view."
2022-04-08,0.0,0.1,"Sector breadth is split evenly (50% above 6-month average) with weak cyclical momentum (-5% relative over 4 weeks) and minimal cross-sector dispersion (3%), suggesting no clear directional edge. This pattern indicates market uncertainty without a compelling rotation signal to act upon."
2022-04-15,0.05,0.35,"Breadth is exactly median (50% of sectors above 6-month average), offering no directional signal. The -7% cyclical underperformance over 4 weeks suggests growth/rate sensitivity headwinds, but low dispersion (5%) indicates a narrow trading range with limited sector differentiation—neither a risk-on nor risk-off signal. The modest underperformance of cyclicals argues against a strong long, while the balanced breadth rules out a defensive short. This is a week with no compelling edge; a tiny long tilt reflects a marginally constructive stance on mean reversion of cyclical underperformance, but conviction is low."
2022-04-22,0.05,0.35,"Breadth is exactly median (50% of sectors above 6-month average), offering no directional signal. The -7% cyclical underperformance over 4 weeks suggests growth/rate sensitivity headwinds, but low dispersion (5%) indicates a narrow trading range with limited sector differentiation—neither a risk-on nor risk-off signal. The modest underperformance of cyclicals argues against a strong long, while the balanced breadth rules out a defensive short. This is a week with no compelling edge; a tiny long tilt reflects a marginally constructive stance on mean reversion of cyclical underperformance, but conviction is low."
2022-04-29,-0.35,0.55,"Only 30% of sectors above 6-month averages signals broad weakness and deteriorating breadth. Cyclicals have underperformed defensives by 500bps over 4 weeks, indicating risk-off sentiment and economic deceleration concerns. Low dispersion (5%) suggests consensus positioning into defensive names, leaving limited upside surprise potential. This risk-off setup with deteriorating internals warrants a modest short bias into the week."
2022-05-06,-0.15,0.35,"Only 30% of sectors above their 6-month average signals broad weakness and deteriorating breadth. Cyclicals have underperformed defensives by 1% over 4 weeks, suggesting market participants are rotating away from risk. Low dispersion (5%) indicates narrow leadership and consensus defensive positioning, which typically precedes further weakness when conviction is shallow. This argues for mild bearish tilt, though headline absence and lack of acute crisis limit conviction to modest short."
2022-05-13,-0.35,0.55,"Deteriorating breadth with only 30% of sectors above their 6-month average signals material weakness. Cyclicals significantly underperforming defensives by 4% over 4 weeks suggests a shift toward risk-off positioning and reduced growth expectations. Low dispersion of 4% indicates sector returns are compressed, consistent with a risk-off environment rather than selective strength. While these conditions warrant caution, the signals are not extreme enough to warrant maximum short conviction."
2022-05-20,-0.35,0.55,"Only 20% of sectors above their 6-month average signals broad weakness and deteriorating breadth. Cyclicals underperforming defensives by 5% over the last month suggests risk-off rotation, indicating investor caution about near-term growth. Low sector dispersion (7%) combined with these negative signals points to correlated downside rather than opportunity for rotation plays, warranting a modest short bias into the coming week."
2022-05-27,0.0,0.0,"Breadth is deteriorating (only 40% of sectors above 6-month average) and cyclicals have underperformed defensives by 2% over four weeks, signaling risk-off sentiment. However, dispersion remains moderate at 6%, and the evidence does not constitute a clear directional edge warranting a tactical position. I have no conviction to lean long or short for the coming week."
2022-06-03,0.0,0.15,"Breadth is severely compressed with only 30% of sectors above 6-month average, cyclicals flat relative to defensives, and minimal dispersion (3%) indicating lack of directional conviction across the market. This is a regime offering no reliable edge for positioning; the neutral stance appropriately reflects uncertainty and absence of a clear rotational signal."
2022-06-10,0.0,0.2,"Only 20% of sectors above their 6-month average indicates broad weakness and limited participation; zero relative return of cyclicals versus defensives shows no momentum or leadership; 4% dispersion is low, suggesting lack of meaningful price discovery. These conditions offer no clear directional edge for the coming week."
2022-06-17,-0.25,0.4,"Only 10% of sectors above their 6-month average signals broad market weakness and deteriorating breadth, a structural red flag. Cyclicals marginally outperformed defensives (+1%), but dispersion remains compressed at 3%, suggesting rotations are shallow and lack conviction. This combination points to underlying market fragility with limited upside catalysts."
2022-06-24,-0.35,0.55,"Zero sectors above 6-month average represents extreme market weakness and capitulation. Cyclicals underperforming defensives by 3% over 4 weeks signals economic slowdown concerns. Low dispersion (5%) indicates narrow selling pressure rather than rotation opportunity, consistent with broad market distress rather than sector-specific opportunities. This warrants a moderate short bias given the severity of breadth deterioration, though conviction is tempered by uncertainty about whether weakness is already priced or will accelerate further."
2022-07-01,-0.35,0.55,"Extreme sector breadth deterioration (only 10% above 6-month average) combined with a sharp 9% cyclical underperformance over 4 weeks signals weakening market internals and a risk-off regime; the low dispersion (5%) suggests consensus defensiveness rather than opportunity. This positioning reflects elevated downside risk without overwhelming conviction, as current data is consistent with a rotation into quality rather than outright crash dynamics."
2022-07-08,-0.45,0.65,"All eleven sectors trading below 6-month averages signals broad-based structural weakness with no safe haven, while cyclicals underperforming defensives by 5% over four weeks indicates deteriorating growth expectations and risk-off sentiment. Low dispersion (7%) suggests consensus pessimism rather than rotation opportunity, pointing to continued downside pressure."
2022-07-15,-0.35,0.6,"Zero sectors trading above their 6-month average signals severe market-wide deterioration and breakdown in breadth. Cyclicals have sharply underperformed defensives by 6% over four weeks, indicating growth concerns and risk-off sentiment. Low dispersion (5%) with uniform weakness across sectors rather than rotation suggests systemic pressure rather than sector reshuffling, warranting a modest short bias into what appears to be a corrective environment."
2022-07-22,-0.3,0.4,"All sectors trading below 6-month averages signals broad weakness and broken uptrends, which is bearish. However, cyclical sectors have outperformed defensives by 1% recently, suggesting some residual risk appetite. The combination of universal underperformance against longer-term averages with extreme low dispersion (2%) points to a congested, weak-to-neutral backdrop with limited conviction for either direction, warranting a modest short bias rather than a strong directional call."
2022-07-29,0.15,0.45,"Cyclicals have significantly outperformed defensives (+7% over 4 weeks) and 60% of sectors are above their 6-month mean, suggesting residual momentum and some breadth support. However, the narrow 5% dispersion across sectors indicates consensus rather than genuine conviction, and the cyclical outperformance is already a 4-week backlog suggesting potential maturity. A modest long bias is warranted but not aggressive given limited fresh drivers."
2022-08-05,0.0,0.0,"Current breadth and rotation metrics offer no directional edge: equal breadth (50% above 6-month average), cyclical outperformance (+5%) already captured, and benign dispersion (4%) suggest equilibrium. Without a clear driver, standing aside is appropriate."
2022-08-12,0.65,0.68,"Cyclical outperformance of +9% over 4 weeks paired with 80% of sectors above 6-month average signals broad internal strength and momentum expansion. Low dispersion (5%) indicates this is a market-wide move rather than narrow leadership, which provides confidence in directional conviction. The breadth picture supports risk assets for the coming week, though absence of more extreme conditions prevents maximum commitment."
2022-08-19,0.05,0.25,"Broad sector participation (80% above 6-month average) and modest cyclical outperformance (+1% last 4 weeks) suggest underlying market health, but low dispersion (3%) indicates synchronized rather than conviction-driven moves. The setup lacks sharp differentiation to justify meaningful directional conviction."
2022-08-26,0.0,0.15,"Sector rotation breadth is extremely weak with only 40% of sectors above their 6-month average, and cyclicals show no relative momentum versus defensives over the past month. The 3% dispersion is low, indicating consensus and lack of rotational conviction across the market. These conditions offer minimal tactical edge for directional positioning."
2022-09-02,-0.25,0.4,"Only 20% of sectors trading above their 6-month average signals broad deterioration in the market structure, with cyclicals underperforming defensives by 1% over four weeks. The modest 5% dispersion suggests this is not a dislocated, mean-reversion-friendly regime, but rather a broad weakness that warrants modest defensive positioning into the new week."
2022-09-09,-0.15,0.35,"Only 40% of sectors trade above 6-month averages, suggesting a weak, narrow market with limited breadth support. Cyclicals have underperformed defensives by 3% over four weeks, indicating risk-off sentiment and deteriorating growth expectations. Low dispersion (3%) shows sector moves are clustered, typical of broad-based downside pressure rather than selective opportunity. This combination warrants a modest defensive tilt, though the weakness is not yet severe enough for high conviction short positioning."
2022-09-16,-0.35,0.55,"Only 20% of sectors trading above 6-month averages signals weak breadth and deteriorating participation, a structural red flag. Cyclicals have underperformed defensives by 2% over four weeks, consistent with risk-off rotation. Low 3% return dispersion suggests a crowded, consensus-driven market vulnerable to repricing. Combined, these point to latent weakness rather than opportunity, warranting a modest short bias into the coming week."
2022-09-23,-0.3,0.4,"All sectors trading below their 6-month averages with cyclicals lagging defensives by 5% over 4 weeks signals broad deterioration and risk-off conditions. Low dispersion (3%) suggests market-wide weakness rather than sector-driven opportunity, favoring caution. Modest short bias reflects genuine distribution of negative signals without sufficient edge for stronger conviction."
2022-09-30,-0.3,0.4,"Zero sectors trading above their 6-month average signals severe market-wide deterioration and mean reversion vulnerability. Cyclicals underperforming defensives by 1% over 4 weeks suggests risk-off rotation is intact, and extremely low dispersion (3%) indicates a narrow, crowded unidirectional move. This setup favors caution, but lack of extreme dispersion prevents a higher conviction short."
2022-10-07,-0.25,0.35,"Sector breadth is severely compressed with only 10% of sectors above their 6-month average, signaling deteriorating participation and market health. The flat cyclical-defensive spread and extremely low dispersion (6%) suggest sluggish momentum and investor indecision rather than conviction in either direction. This narrow, weak breadth environment historically precedes modest pullback risk, warranting a small defensive tilt rather than outright shorts given the low conviction signal."
2022-10-14,-0.25,0.35,"Sector breadth is severely compressed with only 10% of sectors above their 6-month average, signaling deteriorating participation and market health. The flat cyclical-defensive spread and extremely low dispersion (6%) suggest sluggish momentum and investor indecision rather than conviction in either direction. This narrow, weak breadth environment historically precedes modest pullback risk, warranting a small defensive tilt rather than outright shorts given the low conviction signal."
2022-10-21,-0.35,0.55,"Extreme sector concentration (only 10% above 6-month average) signals deteriorating breadth and market fragility, despite recent cyclical outperformance. The 9% dispersion reflects bifurcation rather than healthy participation. A market showing such narrow leadership typically reverses into weakness; the cyclical bounce appears exhausted and vulnerable to mean reversion."
