date,pos,conviction,reasoning
2012-01-13,0.65,0.72,"All sectors above 6-month averages with cyclicals outperforming defensives by 6% over 4 weeks signals broad-based bullish momentum and risk-on positioning. Low dispersion (3%) indicates cohesive sector participation rather than narrow leadership, reducing typical rotation risks. The confluence of universal strength and cyclical dominance warrants a meaningfully long position for the coming week."
2012-01-20,0.35,0.6,"All sectors trading above 6-month averages with cyclicals outperforming defensives by 7% signals broad risk-on positioning and strong breadth. However, 4% dispersion suggests modest conviction across the market rather than extreme consensus, warranting a moderately constructive but not aggressive posture for the coming week."
2012-01-27,0.35,0.55,"All sectors above 6-month average and cyclicals outperforming defensives by 900bp over 4 weeks signals broad positive momentum and risk-on appetite. However, 4% dispersion is moderate, not extreme, indicating breadth is good but not panicked. This warrants a modest long position, but the absence of more extreme readings and sector concentration metrics argues against aggressive sizing."
2012-02-03,0.35,0.6,"All sectors trading above 6-month averages with cyclicals outperforming defensives by 7% signals broad risk-on positioning and strong breadth. However, 4% dispersion suggests modest conviction across the market rather than extreme consensus, warranting a moderately constructive but not aggressive posture for the coming week."
2012-02-10,0.5,0.65,"All sectors trading above 6-month averages and cyclicals outperforming defensives by 3% over 4 weeks signals broad risk-on positioning with meaningful breadth. However, low dispersion (2%) suggests tight sector consensus with limited rotational energy; this restrains conviction. The setup favors equity exposure but lacks the extreme breadth extremes that would warrant full commitment."
2012-02-17,0.1,0.35,"All sectors above their 6-month average and cyclicals outperforming defensives modestly suggest a healthy backdrop, but the tight 2% dispersion indicates consensus breadth rather than conviction-driven rotation. The cyclical edge is mild and not yet compelling enough to justify aggressive positioning into an uncertain week ahead."
2012-02-24,0.0,0.2,"All sectors above 6-month average and modest cyclical outperformance suggest a healthy backdrop, but extremely low dispersion (2%) indicates narrow leadership and lack of conviction breadth. Without headline drivers or deteriorating technicals, conditions appear neither compellingly bullish nor bearish—stand aside and await clearer directional signal."
2012-03-02,0.0,0.1,"All sectors above 6-month average, but cyclical-defensive relative return is flat and cross-sector dispersion is minimal (2%), indicating no meaningful rotation signal or breadth conviction. The data offers no directional edge for the coming week."
2012-03-09,0.0,0.2,"All sectors trading above 6-month averages reflects broad strength with no breadth edge. Cyclical underperformance by 1% and minimal dispersion (2%) indicate low relative momentum and tight consensus—neither a risk-on nor risk-off setup. Without a clear rotation signal or breadth driver, the prudent stance is to stand aside and wait for stronger directional evidence."
2012-03-16,0.1,0.35,"All sectors above their 6-month average and cyclicals outperforming defensives modestly suggest a healthy backdrop, but the tight 2% dispersion indicates consensus breadth rather than conviction-driven rotation. The cyclical edge is mild and not yet compelling enough to justify aggressive positioning into an uncertain week ahead."
2012-03-23,0.0,0.15,"All sectors above their 6-month average indicates breadth is broad but not exceptional, while modest cyclical outperformance and low dispersion suggest the market lacks a clear directional conviction driver. With no compelling rotation signal or breadth extremes, the setup offers no edge for positioning in either direction."
2012-03-30,0.0,0.1,"All sectors above 6-month average suggests broad strength, but cyclical-defensive spread flat and sector dispersion of only 3% indicate synchronized, low-conviction movement with no clear directional edge. Market breadth lacks the differentiation needed to establish conviction for a sector rotation view."
2012-04-06,0.05,0.25,"90% of sectors above 6-month average suggests broad strength and limited downside vulnerability, but zero relative return for cyclicals over 4 weeks and minimal dispersion (3%) indicate momentum is stalling and breadth is becoming shallow. This is a maintenance setup with slight long bias rather than a conviction entry."
2012-04-13,0.1,0.3,"Breadth is reasonably healthy with 80% of sectors above their 6-month average, supporting modest upside. However, cyclical underperformance versus defensives (-2% over 4 weeks) and low dispersion (3%) suggest the market lacks conviction and momentum—investors are rotating into safety. This creates a slight bias toward being constructively positioned, but the absence of clear cyclical leadership and breadth divergence prevents stronger conviction."
2012-04-20,0.0,0.2,"Breadth reading is constructive (90% of sectors above 6-month average), but cyclical underperformance (-3% vs defensives over 4 weeks) and compressed dispersion (2%, indicating crowded/undifferentiated moves) signal caution. No clear directional edge emerges; standing aside is appropriate."
2012-04-27,0.05,0.25,"All sectors above 6-month averages suggests broad uptrend support, but -1% cyclical underperformance combined with minimal dispersion (1%) indicates lack of conviction in the breadth of strength. The absence of a clear rotation signal or dispersion edge argues for near-neutral positioning; slight long tilt reflects the universal elevation above long-term means as a marginal support, but magnitude remains muted given ambiguous directional drivers."
2012-05-04,0.05,0.35,"Breadth is exceptionally strong at 90% of sectors above 6-month average, suggesting underlying market health and limited mean-reversion risk. However, cyclicals have lagged defensives by 2% over 4 weeks with minimal dispersion (2%), indicating market caution amid concentrated narrow strength. The combination argues for a slight long bias but with low conviction—this is a week to remain mostly flat given insufficient directional clarity."
2012-05-11,0.1,0.35,"Broad sector participation (80% above 6-month average) suggests healthy internal breadth, but cyclical underperformance of -4% over 4 weeks signals investor caution about growth/economic momentum. Low dispersion (3%) indicates muted conviction across the market. Slight long bias reflects breadth strength, but cyclical weakness warrants modest sizing given mixed signals."
2012-05-18,-0.15,0.35,"Only 40% of sectors trade above 6-month averages—well below healthy breadth levels—and cyclicals have underperformed defensives by 7% over four weeks, signaling risk-off sentiment and deteriorating market internals. However, low dispersion (3%) suggests limited conviction in the selloff itself, warranting a modest bearish tilt rather than aggressive shorting."
2012-05-25,0.05,0.25,"Cyclicals have underperformed defensives significantly (-6% over 4 weeks), suggesting modest risk-off sentiment, while sector breadth is deteriorating (only 50% above 6M average) with very low dispersion (3%). These are cautious signals, but the lack of extreme deterioration and balanced sectoral positioning prevent a strong bearish call. A slight long bias reflects market structure remaining intact despite headwinds."
2012-06-01,-0.3,0.4,"Weak breadth (only 20% of sectors above 6-month average) and sustained underperformance of cyclicals relative to defensives (-6% over 4 weeks) suggest market structure deterioration and risk-off tilting. Modest dispersion (3%) indicates lack of strong sector conviction, limiting downside conviction, but the breadth signal argues against bullish positioning."
2012-06-08,0.05,0.25,"Breadth is lukewarm at 60% above 6-month average, and cyclicals have underperformed defensives by 3% over four weeks, suggesting modest risk-off tilt. However, low dispersion (2%) indicates lack of extreme divergence. No compelling edge warrants strong positioning; slight long bias reflects neutral-to-slightly-constructive undertone with minimal conviction."
2012-06-15,0.0,0.0,"Sector rotation signals are neutral: 60% above 6-month average shows modest breadth, cyclicals have generated zero relative momentum, and dispersion is minimal at 1%. No genuine edge exists for directional conviction."
2012-06-22,0.05,0.25,Breadth is slightly constructive (60% above 6m average) but dispersion and cyclical underperformance suggest modest internal weakness. No compelling edge; minimal long bias reflects slight structural positivity rather than conviction.
2012-06-29,0.05,0.25,"Breadth is moderately healthy (70% above 6-month average) with a slight cyclical lean (+1% rel return), but extremely tight dispersion (1%) signals consensus and low divergence. The combination suggests mild momentum but no compelling rotational edge; conviction is muted by compressed opportunity set."
2012-07-06,0.0,0.0,"Breadth metrics show 60% of sectors above their 6-month average, which is modest and uninspiring—well below signs of genuine market strength. Cyclicals have underperformed defensives by 1% over the last month, suggesting no risk-on momentum. Ultra-low dispersion (1%) indicates sector returns are tightly clustered with no standout leadership or rotation signal. These conditions offer no clear directional edge."
2012-07-13,0.05,0.25,Breadth is slightly constructive (60% above 6m average) but dispersion and cyclical underperformance suggest modest internal weakness. No compelling edge; minimal long bias reflects slight structural positivity rather than conviction.
2012-07-20,0.05,0.25,"Sector breadth is above the midline at 60%, and cyclical underperformance by only 2% over 4 weeks suggests no severe risk-off environment. However, low return dispersion (2%) indicates narrow leadership and limited sector rotation conviction. The data offers a mild positive lean—above 50% breadth argues against defensiveness—but lacks the clarity needed for a meaningful directional bet."
2012-07-27,0.05,0.35,"Breadth is exceptionally strong at 90% of sectors above 6-month average, suggesting underlying market health and limited mean-reversion risk. However, cyclicals have lagged defensives by 2% over 4 weeks with minimal dispersion (2%), indicating market caution amid concentrated narrow strength. The combination argues for a slight long bias but with low conviction—this is a week to remain mostly flat given insufficient directional clarity."
2012-08-03,0.05,0.3,"Breadth is near-extreme (90% of sectors above 6-month average) but rotation is stalling: cyclicals lagging defensives by 1% over 4 weeks and very low dispersion (2%) suggest complacency or consolidation rather than conviction in risk. The mix hints at exhaustion in the breadth rally without follow-through from cyclical leadership, warranting a small cautious long bias while respecting genuine uncertainty."
2012-08-10,0.05,0.25,"All sectors above 6-month averages suggests broad strength, but only 2% cyclical outperformance over 4 weeks is modest—not a clear risk-on signal. 3% dispersion indicates relatively tight sector clustering without dominant leadership. This is a near-consensus long landscape with limited differentiation; no meaningful edge detected for tactical directional positioning."
2012-08-17,0.3,0.55,"All sectors above their 6-month average and cyclicals outperforming defensives by 4% over the past month suggest broad strength and risk appetite. However, the low 3% dispersion indicates sector returns are clustering together—a compression that often precedes either consolidation or rotation. Without additional breadth deterioration signals or clearer tactical tilts, I take a modest long bias while acknowledging limited edge for the coming week."
2012-08-24,0.05,0.25,"All sectors trading above 6-month average signals broad strength, and cyclicals leading defensives by 4% suggests risk appetite. However, extremely low dispersion (2%) indicates sector rotation is muted and momentum may be fading; breadth lacks conviction. Without material near-term catalysts and given the narrow range of outcomes, this warrants only a small long lean rather than a meaningful overweight."
2012-08-31,0.5,0.65,"All sectors trading above 6-month averages and cyclicals outperforming defensives by 3% over 4 weeks signals broad risk-on positioning with meaningful breadth. However, low dispersion (2%) suggests tight sector consensus with limited rotational energy; this restrains conviction. The setup favors equity exposure but lacks the extreme breadth extremes that would warrant full commitment."
2012-09-07,0.5,0.65,"All sectors trading above 6-month averages and cyclicals outperforming defensives by 3% over 4 weeks signals broad risk-on positioning with meaningful breadth. However, low dispersion (2%) suggests tight sector consensus with limited rotational energy; this restrains conviction. The setup favors equity exposure but lacks the extreme breadth extremes that would warrant full commitment."
2012-09-14,0.0,0.0,"All sectors above 6-month average with only 3% dispersion suggests a broad, uniform rally with no directional edge. Cyclical outperformance exists but lacks the magnitude or supporting breadth breakdown to signal sector rotation strength. Without additional drivers, lack of differentiation argues for neutrality."
2012-09-21,0.1,0.35,"All sectors above their 6-month average and cyclicals outperforming defensives modestly suggest a healthy backdrop, but the tight 2% dispersion indicates consensus breadth rather than conviction-driven rotation. The cyclical edge is mild and not yet compelling enough to justify aggressive positioning into an uncertain week ahead."
2012-09-28,0.0,0.2,"All sectors above 6-month average and modest cyclical outperformance suggest a healthy backdrop, but extremely low dispersion (2%) indicates narrow leadership and lack of conviction breadth. Without headline drivers or deteriorating technicals, conditions appear neither compellingly bullish nor bearish—stand aside and await clearer directional signal."
2012-10-05,0.0,0.2,"All sectors trading above 6-month averages reflects broad strength with no breadth edge. Cyclical underperformance by 1% and minimal dispersion (2%) indicate low relative momentum and tight consensus—neither a risk-on nor risk-off setup. Without a clear rotation signal or breadth driver, the prudent stance is to stand aside and wait for stronger directional evidence."
2012-10-12,0.1,0.35,"All sectors above 6-month average indicates broad strength, but cyclical underperformance and tight dispersion suggest consolidation rather than fresh momentum. Low dispersion reveals lack of conviction among investors; cyclical weakness amid strength is a caution flag. Modest long bias reflects balanced risk/reward with no clear directional edge."
2012-10-19,0.15,0.35,"Ninety percent of sectors above their 6-month average signals broad internal health and reduced downside risk, supporting a modest long bias. However, cyclicals have lagged defensives by 2% over four weeks, suggesting fading momentum and risk appetite—a cautionary signal. The low 3% dispersion indicates compressed divergence, leaving little alpha from sector selection and limiting conviction in a directional bet. A small constructive tilt reflects the breadth advantage offset by cyclical weakness and narrow conviction drivers."
2012-10-26,0.05,0.25,"Breadth is healthy with 80% of sectors above their 6-month average, suggesting underlying market resilience. However, the 1% cyclical underperformance over 4 weeks and very tight dispersion (2%) indicate a narrow, consensus-driven market with limited rotational energy. This lack of differentiation and cyclical weakness argues against a strong long stance, but breadth doesn't warrant tactical shorts. A modest long bias reflects the breadth positive while respecting the absence of meaningful conviction drivers."
2012-11-02,0.1,0.3,"80% of sectors above 6-month averages and 4-week cyclical outperformance by 1% suggest modest positive momentum, but the tight 2% dispersion indicates narrow leadership and lack of conviction. Market breadth is moderately healthy but not compelling—standing largely aside with a small constructive lean."
2012-11-09,0.0,0.3,"Sector breadth shows only modest cyclical outperformance (+2%) with just 60% of sectors above their 6-month mean—neither sufficiently extended to justify conviction in either direction. Low dispersion (2%) and mixed breadth signal a market lacking a clear rotational or directional edge, warranting a neutral stance until a stronger signal emerges."
2012-11-16,0.0,0.0,"Breadth is severely compressed with only 30% of sectors above their 6-month average, signaling broad weakness rather than rotational opportunity. The 1% cyclical-defensive outperformance and 1% return dispersion indicate minimal sector differentiation, leaving no meaningful momentum or rotation signal to trade. This environment favors staying neutral."
2012-11-23,0.25,0.45,"Cyclical outperformance over the past month and broad sector participation above the 6-month line suggest modest near-term momentum, but low dispersion (3%) indicates limited convictability in sector rotation drivers. The combination warrants a modest constructive lean rather than conviction positioning."
2012-11-30,0.0,0.0,Breadth metrics (70% above 6-month average) suggest an already-extended market with limited rotation edge. Cyclical outperformance of only +1% over 4 weeks and tight dispersion (2%) indicate narrow leadership without compelling directional conviction. No clear sector rotation signal warrants risk-taking.
2012-12-07,0.05,0.25,"Eighty percent of sectors above their 6-month average suggests broad health, but zero relative outperformance of cyclicals over defensives in the past month, combined with extremely low cross-sector return dispersion (1%), indicates a market lacking conviction or clear directional bias. The absence of meaningful rotation signals means there is minimal edge to exploit on sector rotation grounds—my specialty. A modest long tilt reflects the positive breadth backdrop, but low conviction reflects the absence of a compelling driver."
2012-12-14,0.05,0.25,"Breadth is moderately healthy (70% above 6-month average) with a slight cyclical lean (+1% rel return), but extremely tight dispersion (1%) signals consensus and low divergence. The combination suggests mild momentum but no compelling rotational edge; conviction is muted by compressed opportunity set."
2012-12-21,0.1,0.3,"80% of sectors above 6-month averages and 4-week cyclical outperformance by 1% suggest modest positive momentum, but the tight 2% dispersion indicates narrow leadership and lack of conviction. Market breadth is moderately healthy but not compelling—standing largely aside with a small constructive lean."
2012-12-28,0.15,0.4,"Cyclicals have outperformed defensives by 3% over 4 weeks and 60% of sectors trade above their 6-month average, suggesting modest positive breadth and rotation into risk. However, 2% dispersion is low, indicating sector consensus is narrow and conviction across the market is diffuse. This environment offers only modest edge—enough to be modestly long, but not aggressively so."
2013-01-04,0.05,0.25,"All sectors above 6-month average and cyclicals outperforming suggest broad-based strength, but the extremely low 2% dispersion indicates most sectors are moving together with little meaningful breadth differentiation, while the modest 5% cyclical excess hints at rotation that may already be priced. This uniformity offers minimal rotational edge, warranting a small cautiously constructive lean."
2013-01-11,0.0,0.0,"Sector breadth is extremely strong (90% above 6-month average) and cyclical outperformance is robust (+4% in 4 weeks), yet dispersion remains remarkably tight at 2%, indicating a crowded consensus rather than genuine conviction-driving divergence. The setup offers no edge for directional positioning."
2013-01-18,0.15,0.4,"Breadth is unusually strong (90% of sectors above 6-month average) and cyclicals have recently outperformed, suggesting risk appetite is present. However, low dispersion (2%) indicates sectors are moving together without conviction, and cyclical outperformance is modest. This points to a modest long bias rather than aggressive risk-on positioning; most of the strength appears already reflected in prices."
2013-01-25,0.15,0.4,"Breadth is unusually strong (90% of sectors above 6-month average) and cyclicals have recently outperformed, suggesting risk appetite is present. However, low dispersion (2%) indicates sectors are moving together without conviction, and cyclical outperformance is modest. This points to a modest long bias rather than aggressive risk-on positioning; most of the strength appears already reflected in prices."
2013-02-01,0.0,0.2,"All sectors trading above 6-month averages reflects broad strength with no breadth edge. Cyclical underperformance by 1% and minimal dispersion (2%) indicate low relative momentum and tight consensus—neither a risk-on nor risk-off setup. Without a clear rotation signal or breadth driver, the prudent stance is to stand aside and wait for stronger directional evidence."
2013-02-08,0.0,0.2,"All sectors trading above 6-month averages reflects broad strength with no breadth edge. Cyclical underperformance by 1% and minimal dispersion (2%) indicate low relative momentum and tight consensus—neither a risk-on nor risk-off setup. Without a clear rotation signal or breadth driver, the prudent stance is to stand aside and wait for stronger directional evidence."
2013-02-15,0.05,0.25,"All sectors above 6-month averages suggests broad uptrend support, but -1% cyclical underperformance combined with minimal dispersion (1%) indicates lack of conviction in the breadth of strength. The absence of a clear rotation signal or dispersion edge argues for near-neutral positioning; slight long tilt reflects the universal elevation above long-term means as a marginal support, but magnitude remains muted given ambiguous directional drivers."
2013-02-22,0.0,0.0,"All sectors trading above 6-month averages suggests elevated valuations across the board with limited selectivity opportunity. Cyclicals underperforming defensives by 3% over four weeks combined with very low cross-sector dispersion (2%) indicates the market is shifting toward defensive positioning and consolidating. Without meaningful breadth or sector differentiation signals, there is no sector rotation edge to exploit."
2013-03-01,0.05,0.25,"All sectors above 6-month average suggests broad strength, but cyclical underperformance vs. defensives (-2% over 4 weeks) indicates cautious positioning and possible growth/rate concerns. Very tight dispersion (1%) suggests homogeneous sector behavior with limited rotation tailwinds. Mild long bias only given the uniform strength, but limited conviction without clearer breadth or sector leadership signals."
2013-03-08,0.0,0.0,"All sectors trading above 6-month average suggests broad strength, but zero cyclical-defensive relative return and minimal cross-sector dispersion indicate a market with no clear directional or rotational bias. This is precisely the neutral setup where edge is absent and sizing down is prudent."
2013-03-15,0.05,0.25,"All sectors above 6-month averages suggests broad uptrend support, but -1% cyclical underperformance combined with minimal dispersion (1%) indicates lack of conviction in the breadth of strength. The absence of a clear rotation signal or dispersion edge argues for near-neutral positioning; slight long tilt reflects the universal elevation above long-term means as a marginal support, but magnitude remains muted given ambiguous directional drivers."
2013-03-22,0.0,0.0,"All sectors trading above 6-month average suggests broad strength, but zero cyclical-defensive relative return and minimal cross-sector dispersion indicate a market with no clear directional or rotational bias. This is precisely the neutral setup where edge is absent and sizing down is prudent."
2013-03-29,0.05,0.25,"All sectors above 6-month average suggests broad strength, but cyclical underperformance vs. defensives (-2% over 4 weeks) indicates cautious positioning and possible growth/rate concerns. Very tight dispersion (1%) suggests homogeneous sector behavior with limited rotation tailwinds. Mild long bias only given the uniform strength, but limited conviction without clearer breadth or sector leadership signals."
2013-04-05,0.0,0.0,"All sectors above 6-month average reflects broad strength, but cyclicals have underperformed defensives by 6% over 4 weeks—a significant mean-reversion flag. Low dispersion (3%) paired with this rotation weakness suggests consolidation without decisive leadership. No clear edge to take for the coming week."
2013-04-12,0.0,0.0,"All sectors above 6-month averages suggests a healthy broad backdrop, but cyclicals underperforming defensives by 6% over 4 weeks signals caution and risk-off rotation. The 4% cross-sector dispersion is modest, indicating no extreme breadth extremes. These mixed signals—universal elevation paired with cyclical weakness—offer no clear directional edge for the coming week. I stand aside."
